{
  "schema_version": "1.0.0",
  "event_type": "FILE_METADATA_UPSERT",
  "event_time": "2026-07-23T10:00:00Z",
  "repository": "huggingface/datasets",
  "file_id": "ef73a9c1b79b71681f6110d07260f0139d34a8c19beccca1dbfc8b34f8bc019c",
  "path": "src/datasets/task6_demo.py",
  "content_sha256": "aaaaaaaaaaaaaaaaaaaaaaaaaaaaaaaaaaaaaaaaaaaaaaaaaaaaaaaaaaaaaaaa",
  "language": "python",
  "size_bytes": 120,
  "line_count": 8,
  "ast_node_count": 12,
  "ast_edge_count": 11,
  "cfg_edge_count": 5,
  "dfg_edge_count": 3,
  "call_edge_count": 1,
  "status": "PARSED"
}
